{
  "$schema": "https://json-schema.org/draft/2020-12/schema",
  "title": "Evidence Pack v0.1",
  "type": "object",
  "required": [
    "case_id",
    "dispute_type",
    "facts",
    "policy"
  ],
  "properties": {
    "case_id": {
      "type": "string",
      "minLength": 1
    },
    "dispute_type": {
      "enum": [
        "no_show_charge",
        "route_deviation"
      ]
    },
    "facts": {
      "type": "array",
      "items": {
        "type": "object",
        "required": [
          "evidence_id",
          "fact",
          "source"
        ],
        "properties": {
          "evidence_id": {
            "type": "string",
            "minLength": 1
          },
          "fact": {
            "type": "string",
            "minLength": 1
          },
          "source": {
            "type": "string",
            "minLength": 1
          }
        },
        "additionalProperties": true
      }
    },
    "policy": {
      "type": "array",
      "items": {
        "type": "object",
        "required": [
          "policy_id",
          "rule",
          "source"
        ],
        "properties": {
          "policy_id": {
            "type": "string",
            "minLength": 1
          },
          "rule": {
            "type": "string",
            "minLength": 1
          },
          "source": {
            "type": "string",
            "minLength": 1
          }
        },
        "additionalProperties": true
      }
    }
  },
  "additionalProperties": true
}
